{
  "schema": "revenue.recognition/v2",
  "recognition_id": "revrec-001",
  "project_id": "project-001",
  "decision": "RECOGNIZED",
  "settlement_receipt_digest": "cd3a1886789eb431dde2b06feb4236bcf0f5d6f97f327de9204ec437fb8222e8",
  "capital_authorization_digest": "1e814153a18850865543e08b498b60d9bce80dbd34bfb2f4c378f3fe502fe89f",
  "project_evidence_digest": "6666666666666666666666666666666666666666666666666666666666666666",
  "counterparty_id": "external-customer-001",
  "counterparty_relation": "EXTERNAL_NON_RELATED",
  "counterparty_evidence_digest": "1111111111111111111111111111111111111111111111111111111111111111",
  "revenue_destination_id": "project-001-revenue-account",
  "contract_digest": "2222222222222222222222222222222222222222222222222222222222222222",
  "invoice_digest": "3333333333333333333333333333333333333333333333333333333333333333",
  "invoice_reporting_amount": "125",
  "delivery_evidence_digest": "4444444444444444444444444444444444444444444444444444444444444444",
  "accounting_policy_digest": "5555555555555555555555555555555555555555555555555555555555555555",
  "settlement_asset": "USDC",
  "settlement_amount": "125",
  "reporting_currency": "USDC",
  "fx_rate_to_reporting": "1",
  "gross_reporting_amount": "125",
  "tax_reporting_amount": "5",
  "refund_reserve_reporting_amount": "2",
  "recognized_reporting_amount": "118",
  "performance_state": "SATISFIED",
  "dispute_state": "CLEAR",
  "fx_evidence_digest": null,
  "recognized_at": "2026-08-19T10:30:00Z",
  "blockers": [],
  "ledger_posting_allowed": true,
  "accounting_authority": "Shtenco/synergy_financial_os",
  "ledger_posting_authority": "SEPARATE_REPORTING_LEDGER_POST",
  "ai_authority": "NONE",
  "digest": "422f66737f129a3b714c16a1212287dc0ccf243efa51c4ce1a7eb65cd56fbfa3"
}
